{
  "schemaVersion": 1,
  "profile": "HarnessTest.SquareCharacter.Structure",
  "profileVersion": 1,
  "scenePath": "Assets/TestOnly/HarnessTest.unity",
  "tolerance": 0.0001,
  "checks": [
    {
      "id": "scene.square-character.root",
      "type": "object-layout",
      "path": "/SquareCharacter",
      "passMessage": "SquareCharacter root matches the required transform.",
      "failMessage": "SquareCharacter root is missing, ambiguous, or has the wrong transform.",
      "expected": "unique active /SquareCharacter; Transform only; localPosition=(1.8, 0, 0); identity rotation/scale",
      "active": true,
      "componentCount": 1,
      "localPosition": { "x": 1.8, "y": 0.0, "z": 0.0 },
      "localRotation": { "x": 0.0, "y": 0.0, "z": 0.0, "w": 1.0 },
      "localScale": { "x": 1.0, "y": 1.0, "z": 1.0 }
    },
    {
      "id": "scene.square-character.exact-parts",
      "type": "exact-children",
      "path": "/SquareCharacter",
      "passMessage": "SquareCharacter has exactly the six required direct children.",
      "failMessage": "SquareCharacter must have exactly the six required direct children and no extras.",
      "expected": "Head, Body, LeftArm, RightArm, LeftLeg, RightLeg",
      "children": ["Head", "Body", "LeftArm", "RightArm", "LeftLeg", "RightLeg"]
    },
    {
      "id": "scene.square-character.head.layout",
      "type": "object-layout",
      "path": "/SquareCharacter/Head",
      "passMessage": "Head has the required local layout.",
      "failMessage": "Head is missing, ambiguous, or has the wrong local layout.",
      "expected": "active; Transform + LineRenderer only; localPosition=(0, 1.35, 0); identity rotation/scale",
      "active": true,
      "componentCount": 2,
      "localPosition": { "x": 0.0, "y": 1.35, "z": 0.0 },
      "localRotation": { "x": 0.0, "y": 0.0, "z": 0.0, "w": 1.0 },
      "localScale": { "x": 1.0, "y": 1.0, "z": 1.0 }
    },
    {
      "id": "scene.square-character.head.shape",
      "type": "line-renderer-shape",
      "path": "/SquareCharacter/Head",
      "passMessage": "Head is the required closed axis-aligned square.",
      "failMessage": "Head does not have the required square LineRenderer geometry.",
      "expected": "one enabled local-space non-looping LineRenderer; sortingOrder=11; start/end width=0.08; corner/cap vertices=4; points=[(-0.45, -0.45, 0), (-0.45, 0.45, 0), (0.45, 0.45, 0), (0.45, -0.45, 0), (-0.45, -0.45, 0)]",
      "enabled": true,
      "useWorldSpace": false,
      "loop": false,
      "sortingOrder": 11,
      "startWidth": 0.08,
      "endWidth": 0.08,
      "cornerVertices": 4,
      "capVertices": 4,
      "points": [
        { "x": -0.45, "y": -0.45, "z": 0.0 },
        { "x": -0.45, "y": 0.45, "z": 0.0 },
        { "x": 0.45, "y": 0.45, "z": 0.0 },
        { "x": 0.45, "y": -0.45, "z": 0.0 },
        { "x": -0.45, "y": -0.45, "z": 0.0 }
      ]
    },
    {
      "id": "scene.square-character.head.material",
      "type": "line-renderer-material",
      "path": "/SquareCharacter/Head",
      "passMessage": "Head uses the managed material.",
      "failMessage": "Head does not use the managed material.",
      "expected": "Assets/TestOnly/HarnessBeaconLine.mat",
      "materialPath": "Assets/TestOnly/HarnessBeaconLine.mat"
    },
    {
      "id": "scene.square-character.body.layout",
      "type": "object-layout",
      "path": "/SquareCharacter/Body",
      "passMessage": "Body has the required local layout.",
      "failMessage": "Body is missing, ambiguous, or has the wrong local layout.",
      "expected": "active; Transform + LineRenderer only; localPosition=(0, 0.25, 0); identity rotation/scale",
      "active": true,
      "componentCount": 2,
      "localPosition": { "x": 0.0, "y": 0.25, "z": 0.0 },
      "localRotation": { "x": 0.0, "y": 0.0, "z": 0.0, "w": 1.0 },
      "localScale": { "x": 1.0, "y": 1.0, "z": 1.0 }
    },
    {
      "id": "scene.square-character.body.shape",
      "type": "line-renderer-shape",
      "path": "/SquareCharacter/Body",
      "passMessage": "Body is the required closed axis-aligned square.",
      "failMessage": "Body does not have the required square LineRenderer geometry.",
      "expected": "one enabled local-space non-looping LineRenderer; sortingOrder=11; start/end width=0.08; corner/cap vertices=4; points=[(-0.6, -0.6, 0), (-0.6, 0.6, 0), (0.6, 0.6, 0), (0.6, -0.6, 0), (-0.6, -0.6, 0)]",
      "enabled": true,
      "useWorldSpace": false,
      "loop": false,
      "sortingOrder": 11,
      "startWidth": 0.08,
      "endWidth": 0.08,
      "cornerVertices": 4,
      "capVertices": 4,
      "points": [
        { "x": -0.6, "y": -0.6, "z": 0.0 },
        { "x": -0.6, "y": 0.6, "z": 0.0 },
        { "x": 0.6, "y": 0.6, "z": 0.0 },
        { "x": 0.6, "y": -0.6, "z": 0.0 },
        { "x": -0.6, "y": -0.6, "z": 0.0 }
      ]
    },
    {
      "id": "scene.square-character.body.material",
      "type": "line-renderer-material",
      "path": "/SquareCharacter/Body",
      "passMessage": "Body uses the managed material.",
      "failMessage": "Body does not use the managed material.",
      "expected": "Assets/TestOnly/HarnessBeaconLine.mat",
      "materialPath": "Assets/TestOnly/HarnessBeaconLine.mat"
    },
    {
      "id": "scene.square-character.left-arm.layout",
      "type": "object-layout",
      "path": "/SquareCharacter/LeftArm",
      "passMessage": "LeftArm has the required local layout.",
      "failMessage": "LeftArm is missing, ambiguous, or has the wrong local layout.",
      "expected": "active; Transform + LineRenderer only; localPosition=(-0.95, 0.25, 0); identity rotation/scale",
      "active": true,
      "componentCount": 2,
      "localPosition": { "x": -0.95, "y": 0.25, "z": 0.0 },
      "localRotation": { "x": 0.0, "y": 0.0, "z": 0.0, "w": 1.0 },
      "localScale": { "x": 1.0, "y": 1.0, "z": 1.0 }
    },
    {
      "id": "scene.square-character.left-arm.shape",
      "type": "line-renderer-shape",
      "path": "/SquareCharacter/LeftArm",
      "passMessage": "LeftArm is the required closed axis-aligned square.",
      "failMessage": "LeftArm does not have the required square LineRenderer geometry.",
      "expected": "one enabled local-space non-looping LineRenderer; sortingOrder=11; start/end width=0.08; corner/cap vertices=4; points=[(-0.35, -0.35, 0), (-0.35, 0.35, 0), (0.35, 0.35, 0), (0.35, -0.35, 0), (-0.35, -0.35, 0)]",
      "enabled": true,
      "useWorldSpace": false,
      "loop": false,
      "sortingOrder": 11,
      "startWidth": 0.08,
      "endWidth": 0.08,
      "cornerVertices": 4,
      "capVertices": 4,
      "points": [
        { "x": -0.35, "y": -0.35, "z": 0.0 },
        { "x": -0.35, "y": 0.35, "z": 0.0 },
        { "x": 0.35, "y": 0.35, "z": 0.0 },
        { "x": 0.35, "y": -0.35, "z": 0.0 },
        { "x": -0.35, "y": -0.35, "z": 0.0 }
      ]
    },
    {
      "id": "scene.square-character.left-arm.material",
      "type": "line-renderer-material",
      "path": "/SquareCharacter/LeftArm",
      "passMessage": "LeftArm uses the managed material.",
      "failMessage": "LeftArm does not use the managed material.",
      "expected": "Assets/TestOnly/HarnessBeaconLine.mat",
      "materialPath": "Assets/TestOnly/HarnessBeaconLine.mat"
    },
    {
      "id": "scene.square-character.right-arm.layout",
      "type": "object-layout",
      "path": "/SquareCharacter/RightArm",
      "passMessage": "RightArm has the required local layout.",
      "failMessage": "RightArm is missing, ambiguous, or has the wrong local layout.",
      "expected": "active; Transform + LineRenderer only; localPosition=(0.95, 0.25, 0); identity rotation/scale",
      "active": true,
      "componentCount": 2,
      "localPosition": { "x": 0.95, "y": 0.25, "z": 0.0 },
      "localRotation": { "x": 0.0, "y": 0.0, "z": 0.0, "w": 1.0 },
      "localScale": { "x": 1.0, "y": 1.0, "z": 1.0 }
    },
    {
      "id": "scene.square-character.right-arm.shape",
      "type": "line-renderer-shape",
      "path": "/SquareCharacter/RightArm",
      "passMessage": "RightArm is the required closed axis-aligned square.",
      "failMessage": "RightArm does not have the required square LineRenderer geometry.",
      "expected": "one enabled local-space non-looping LineRenderer; sortingOrder=11; start/end width=0.08; corner/cap vertices=4; points=[(-0.35, -0.35, 0), (-0.35, 0.35, 0), (0.35, 0.35, 0), (0.35, -0.35, 0), (-0.35, -0.35, 0)]",
      "enabled": true,
      "useWorldSpace": false,
      "loop": false,
      "sortingOrder": 11,
      "startWidth": 0.08,
      "endWidth": 0.08,
      "cornerVertices": 4,
      "capVertices": 4,
      "points": [
        { "x": -0.35, "y": -0.35, "z": 0.0 },
        { "x": -0.35, "y": 0.35, "z": 0.0 },
        { "x": 0.35, "y": 0.35, "z": 0.0 },
        { "x": 0.35, "y": -0.35, "z": 0.0 },
        { "x": -0.35, "y": -0.35, "z": 0.0 }
      ]
    },
    {
      "id": "scene.square-character.right-arm.material",
      "type": "line-renderer-material",
      "path": "/SquareCharacter/RightArm",
      "passMessage": "RightArm uses the managed material.",
      "failMessage": "RightArm does not use the managed material.",
      "expected": "Assets/TestOnly/HarnessBeaconLine.mat",
      "materialPath": "Assets/TestOnly/HarnessBeaconLine.mat"
    },
    {
      "id": "scene.square-character.left-leg.layout",
      "type": "object-layout",
      "path": "/SquareCharacter/LeftLeg",
      "passMessage": "LeftLeg has the required local layout.",
      "failMessage": "LeftLeg is missing, ambiguous, or has the wrong local layout.",
      "expected": "active; Transform + LineRenderer only; localPosition=(-0.38, -0.9, 0); identity rotation/scale",
      "active": true,
      "componentCount": 2,
      "localPosition": { "x": -0.38, "y": -0.9, "z": 0.0 },
      "localRotation": { "x": 0.0, "y": 0.0, "z": 0.0, "w": 1.0 },
      "localScale": { "x": 1.0, "y": 1.0, "z": 1.0 }
    },
    {
      "id": "scene.square-character.left-leg.shape",